{
  "$id": "https://local.codex/post-office-next/contracts/v1/operations/message.register.request.schema.json",
  "$schema": "http://json-schema.org/draft-07/schema#",
  "additionalProperties": false,
  "examples": [
    {
      "actor": {
        "id": "PON-ACTOR-001",
        "kind": "HUMAN",
        "role": "courier"
      },
      "aggregate": {
        "expectedVersion": 0,
        "id": "PON-AGGREGATE-001",
        "type": "Example"
      },
      "authority": {
        "authorityGrantId": "PON-GRANT-001",
        "capabilityId": "PON-CAPABILITY-001"
      },
      "operation": "message.register",
      "parameters": {
        "bundleId": "PON-EXAMPLE-001",
        "semanticMessage": {
          "authorityBasisId": "PON-EXAMPLE-001",
          "completionCriteria": "example",
          "contentRoot": "sha256:aaaaaaaaaaaaaaaaaaaaaaaaaaaaaaaaaaaaaaaaaaaaaaaaaaaaaaaaaaaaaaaa",
          "domain": "PON-EXAMPLE-001",
          "id": "PON-EXAMPLE-001",
          "messageType": "example",
          "recipientGeneration": 1,
          "recipientMailboxId": "PON-EXAMPLE-001",
          "relatedMessageIds": [
            "PON-EXAMPLE-001"
          ],
          "requestedAction": "example",
          "semanticCycleId": "PON-EXAMPLE-001",
          "senderEndpointId": "PON-EXAMPLE-001"
        }
      },
      "requestId": "PON-REQUEST-001",
      "schemaVersion": "1"
    }
  ],
  "properties": {
    "actor": {
      "additionalProperties": false,
      "properties": {
        "id": {
          "minLength": 1,
          "pattern": "^[A-Za-z][A-Za-z0-9._:-]{2,127}$",
          "type": "string"
        },
        "kind": {
          "enum": [
            "HUMAN",
            "BROWSER",
            "COURIER",
            "ENDPOINT",
            "SYSTEM"
          ],
          "minLength": 1,
          "type": "string"
        },
        "role": {
          "minLength": 1,
          "type": "string"
        }
      },
      "required": [
        "id",
        "kind",
        "role"
      ],
      "type": "object"
    },
    "aggregate": {
      "additionalProperties": false,
      "anyOf": [
        {
          "required": [
            "expectedVersion"
          ]
        },
        {
          "required": [
            "expectedRoot"
          ]
        }
      ],
      "properties": {
        "expectedRoot": {
          "minLength": 1,
          "pattern": "^(?:sha256:)?[0-9a-f]{64}$",
          "type": "string"
        },
        "expectedVersion": {
          "minimum": 0,
          "type": "integer"
        },
        "id": {
          "minLength": 1,
          "pattern": "^[A-Za-z][A-Za-z0-9._:-]{2,127}$",
          "type": "string"
        },
        "type": {
          "minLength": 1,
          "type": "string"
        }
      },
      "required": [
        "type",
        "id"
      ],
      "type": "object"
    },
    "authority": {
      "oneOf": [
        {
          "additionalProperties": false,
          "properties": {
            "authorityGrantId": {
              "minLength": 1,
              "pattern": "^[A-Za-z][A-Za-z0-9._:-]{2,127}$",
              "type": "string"
            },
            "capabilityId": {
              "minLength": 1,
              "pattern": "^[A-Za-z][A-Za-z0-9._:-]{2,127}$",
              "type": "string"
            },
            "exactAuthorActionId": {
              "minLength": 1,
              "pattern": "^[A-Za-z][A-Za-z0-9._:-]{2,127}$",
              "type": "string"
            }
          },
          "required": [
            "capabilityId",
            "authorityGrantId"
          ],
          "type": "object"
        },
        {
          "additionalProperties": false,
          "properties": {
            "authorityGrantId": {
              "minLength": 1,
              "pattern": "^[A-Za-z][A-Za-z0-9._:-]{2,127}$",
              "type": "string"
            },
            "capabilityId": {
              "minLength": 1,
              "pattern": "^[A-Za-z][A-Za-z0-9._:-]{2,127}$",
              "type": "string"
            },
            "exactAuthorActionId": {
              "minLength": 1,
              "pattern": "^[A-Za-z][A-Za-z0-9._:-]{2,127}$",
              "type": "string"
            }
          },
          "required": [
            "capabilityId",
            "exactAuthorActionId"
          ],
          "type": "object"
        }
      ]
    },
    "operation": {
      "const": "message.register"
    },
    "parameters": {
      "additionalProperties": false,
      "properties": {
        "bundleId": {
          "minLength": 1,
          "pattern": "^[A-Za-z][A-Za-z0-9._:-]{2,127}$",
          "type": "string"
        },
        "semanticMessage": {
          "additionalProperties": false,
          "properties": {
            "authorityBasisId": {
              "minLength": 1,
              "pattern": "^[A-Za-z][A-Za-z0-9._:-]{2,127}$",
              "type": "string"
            },
            "completionCriteria": {
              "minLength": 1,
              "type": "string"
            },
            "contentRoot": {
              "minLength": 1,
              "pattern": "^(?:sha256:)?[0-9a-f]{64}$",
              "type": "string"
            },
            "domain": {
              "minLength": 1,
              "pattern": "^[A-Za-z][A-Za-z0-9._:-]{2,127}$",
              "type": "string"
            },
            "id": {
              "minLength": 1,
              "pattern": "^[A-Za-z][A-Za-z0-9._:-]{2,127}$",
              "type": "string"
            },
            "messageType": {
              "minLength": 1,
              "type": "string"
            },
            "recipientGeneration": {
              "minimum": 1,
              "type": "integer"
            },
            "recipientMailboxId": {
              "minLength": 1,
              "pattern": "^[A-Za-z][A-Za-z0-9._:-]{2,127}$",
              "type": "string"
            },
            "relatedMessageIds": {
              "items": {
                "minLength": 1,
                "pattern": "^[A-Za-z][A-Za-z0-9._:-]{2,127}$",
                "type": "string"
              },
              "minItems": 0,
              "type": "array"
            },
            "requestedAction": {
              "minLength": 1,
              "type": "string"
            },
            "semanticCycleId": {
              "minLength": 1,
              "pattern": "^[A-Za-z][A-Za-z0-9._:-]{2,127}$",
              "type": "string"
            },
            "senderEndpointId": {
              "minLength": 1,
              "pattern": "^[A-Za-z][A-Za-z0-9._:-]{2,127}$",
              "type": "string"
            }
          },
          "required": [
            "id",
            "domain",
            "messageType",
            "senderEndpointId",
            "recipientMailboxId",
            "recipientGeneration",
            "relatedMessageIds",
            "authorityBasisId",
            "requestedAction",
            "completionCriteria",
            "contentRoot",
            "semanticCycleId"
          ],
          "type": "object"
        }
      },
      "required": [
        "semanticMessage",
        "bundleId"
      ],
      "type": "object"
    },
    "requestId": {
      "minLength": 1,
      "pattern": "^[A-Za-z][A-Za-z0-9._:-]{2,127}$",
      "type": "string"
    },
    "schemaVersion": {
      "const": "1"
    }
  },
  "required": [
    "schemaVersion",
    "operation",
    "requestId",
    "actor",
    "authority",
    "parameters",
    "aggregate"
  ],
  "title": "message.register request",
  "type": "object",
  "x-contractStatus": "IMPLEMENTED_P3_4",
  "x-minimumAuthority": "courier",
  "x-mutates": true
}
